Category,Indicator,subTitle,dataType,dataSourceYear,description,chartComment,Note,2009,2010,2011,2012,2013,2014,2015,2016,2017,2018,2009ucl,2010ucl,2011ucl,2012ucl,2013ucl,2014ucl,2015ucl,2016ucl,2017ucl,2018ucl,2009lcl,2010lcl,2011lcl,2012lcl,2013lcl,2014lcl,2015lcl,2016lcl,2017lcl,2018lcl
Alcohol Use,Adult Drinking Prevalence,,Precentage,2016,Percentage of adults who reported drinking alcohol in the past year,,,null,0.83,null,0.83,0.81,0.81,0.82,0.83,null,null,null,0.85,null,0.84,0.84,0.83,0.83,0.84,0.85,null,null,0.81,null,0.81,0.8,0.79,0.8,0.82,null,null
General Health,Adult Overweight and Obesity,,Precentage,2018,Percentage of adults who report their body mass index as overweight or obese,,,0.59,0.56,0.6,0.61,0.62,0.62,0.6,0.61,0.63,0.63,0.61,0.58,0.63,0.63,0.64,0.65,0.62,0.64,0.66,0.65,0.57,0.54,0.58,0.58,0.59,0.6,0.57,0.59,0.61,0.6
General Health,Self-reported General Health,,Precentage,2018,Percentage of adults who reported their health as excellent or very good,,,0.6,0.6,0.58,0.58,0.6,0.58,0.57,0.58,0.55,0.54,0.62,0.62,0.61,0.6,0.62,0.6,0.61,0.6,0.57,0.56,0.58,0.58,0.56,0.55,0.57,0.56,0.56,0.55,0.52,0.51
General Health,Self-reported Mental Health,,Precentage,2018,Percentage of adults who reported their mental health as excellent or very good,,,null,null,0.72,null,0.71,0.73,0.72,0.7,0.65,0.66,null,null,0.76,null,0.74,0.76,0.74,0.72,0.67,0.68,null,null,0.68,null,0.67,0.71,0.7,0.68,0.63,0.63
Injury Prevention,Bike Helmet Use in Children,,Precentage,2017,Percentage of children aged 5-17 years who wear a bike helmet all of the time,,,0.73,0.67,null,0.74,0.72,0.71,0.77,null,0.62,null,0.76,0.72,null,0.8,0.76,0.76,0.81,null,0.67,null,0.69,0.62,null,0.67,0.68,0.67,0.73,null,0.57,null
Injury Prevention,Prevalence of Falls,,Precentage,,Percentage of adults 65 and older who suffered a fall in the past year,,,0.17,0.12,0.17,0.18,0.21,null,0.21,0.16,null,null,0.21,0.16,0.21,0.22,0.25,null,0.25,0.22,null,null,0.12,0.09,0.12,0.14,0.17,null,0.17,0.1,null,null
Tobacco,Successful Quit Attempt in the Last Year,,Precentage,2018,Percentage of smokers who reported quitting smoking for a day or more in the last year,,,0.54,0.44,0.51,0.44,0.5,0.49,0.53,0.5,0.41,0.45,0.59,0.49,0.57,0.49,0.56,0.55,0.59,0.57,0.49,0.52,0.49,0.39,0.45,0.38,0.44,0.43,0.47,0.44,0.34,0.38
Tobacco,Adult Smoking Prevalence,,Precentage,2018,Percentage of adults who reported smoking cigarettes in the past year,,,0.17,0.16,0.12,0.14,0.12,0.11,0.11,0.09,0.15,0.14,0.19,0.17,0.14,0.15,0.14,0.12,0.13,0.10,0.17,0.16,0.16,0.14,0.11,0.12,0.11,0.09,0.1,0.08,0.14,0.12
